Job Title,Job Description
開発経験者歓迎！【SDET(Software Development Engineer in Test)】マネーフォワードクラウド_ 福岡,"福岡開発拠点について マネーフォワードの福岡開発拠点は2017年12月に開設しました。以降多くのエンジニア・デザイナー・インターン生にジョイン頂き、順調に拠点は大きくなっています。 2020年11月末に新拠点に引っ越し開発拠点の更なる成長を目指して、エンジニア・デザイナーの採用を拡大しています。福岡開発拠点では、「Move Forward」を拠点コンセプトにメンバーの成長機会を大切にし、色々な事に果敢に挑戦できるような拠点でありたいと思います。 マネーフォワードではお金に関する課題をテクノロジーで解決するサービスを提供しています。福岡拠点では、マネーフォワードの主力サービスであり、個人事業主・法人向けにサービス提供している「マネーフォワード クラウド経費」「マネーフォワード クラウド債務支払」の開発や運用を行っています。 また、2021年9月に福岡拠点発の新規事業として誕生した、事業用カードなどを提供し、ビジネス領域のキャッシュレスを推進するプラットフォーム「マネーフォワード Pay for Business」の開発を行っています。 募集背景 マネーフォワード福岡開発拠点では、お金に関する様々な課題を解決するためにビジネス向けクラウドサービスである「マネーフォワード クラウド」を始めとした様々なサービスを開発しております。バックオフィス業務に様々なSaaSアプリケーションを提供することで、複雑な日常業務から不要な業務を排除し、仕事の質と時間を根本的に変えることで、人々の生活を前進させることを目指しています。 今後も様々な新規製品や新機能を追加していく中で、スピード感を持った開発、またお客様に満足していただくための品質担保は急務になってきております。 製品やサービスの成長に伴い、製品の品質を保証する包括的なテスト戦略が必要とされています。開発者からSDETへのジョブチェンジを希望する開発者を募集しています。 入社後は座学とOJTで品質に関する知識を習得できますので、ぜひチャレンジください！ 業務内容 to B バックオフィスSaaSプロダクトにおける以下業務をお任せします。 機能テストと非機能テストのための自動テストスクリプトの設計、開発、実装。 モックを使わずに呼び出されるパブリックAPIの機能テスト 継続的な要件とコードレビュー（ソースコードとエッジケースの検証を含む単体テスト用コード） CI/CDにおけるテストシステムの構築とメンテナンス 顧客要件と製品目標を満たすテスト計画の策定 必須スキル・経験 Java, Go, C/C++等々のプログラミング経験３年以上 QAや品質へのご興味 歓迎スキル・経験 情報工学もしくはコンピューターサイエンスにおける、学士号相当の知識　  高い精度の要求仕様を書くための知識や経験 求める語学力 ビジネスレベル以上の日本語力 ビジネス基礎レベルの英語力（TOEIC700点相当以上） ※TOEIC700点相当以上の資格をお持ちでない方については選考プロセスの過程で弊社指定の試験を受験いただきます。（原則、一次面接後を想定） ※ TOEIC 以外にも英語力がわかる資格や経験をお持ちの方はご相談ください 例：英検準1級、英検2級（英検CSEスコア1950以上）、TOEFL iBT 60以上、IELTS 5.0以上、ケンブリッジ英語検定 FCE など。 求める人物像 マネーフォワードのビジョンに強く共感・共鳴していただける方 自らが自社サービスのファンであり、その成長に情熱を込められる方 テスト開発を通じて、プロダクト品質の向上に寄与できる方 福岡のテックコミュニティを盛り上げていきたい方 技術スタック Webサーバーサイド：Ruby on Rails Webフロントエンド：Next.js, Redux, TypeScript, Jest, Apollo Client データベース：MySQL(Aurora) インフラ・ミドルウェア: AWS(ALB, EC2, RDS, S3, SQS, ElastiCache, EKS, ECS...) GCP (BigQuery, Firebase,) nginx,  Puma,  Docker, Redis 使用ツール Biz基盤：Marketo, SalesForce, HubSpot リポジトリ管理：GitHub CI/CD：CircleCI, bitrise, ArgoCD, CodeBuild, Github Action 開発環境:Vagrant, Docker, Terraform Enterprise 監視：DataDog, Rollbar, Bugsnag, Sently, New Relic コミュニケーション：Slack チケット管理:Jira, asana, trello, backlog セキュリティ・自動化: OWASP ZAP, Burp Suite, Sider (Brakeman), Snyk, VAddy, Dockle, Trivy 環境 マネーフォワードでは、共に世界に通じるサービスを創っていく環境を用意し、皆様をお待ちしています。 開発環境/スペック：MacBook Pro / MacBook Air / iMac / Windows MacBook Pro / MacBook Air / iMacに関しては、 ハイスペックPCを標準支給し、Apple最新に合わせ常にアップデートしていきます。開発環境は、つねに最強スペックを維持しますし、特別構成にも対応しています。 快適開発環境支援：業務上必要な備品は、品目の制限なく、会社費用で購入可能です。 MF図書館：技術書から経営本まで、貸し出し自由の図書館制度があります。欲しい本は会社費用で購入できます。 リファラルドリブン：採用会食費の負担。リファラル謝礼金制度。 カンファレンス参加支援:RubyKaigiやGoogle I/Oなど、国内外のカンファレンスへの参加を会社が負担します。 参考記事 CQOメッセージ 新CQO、高橋寿一と池田暁に聞く。これからの10年を支えるマネーフォワードQA戦略の第一歩とは インタビュー記事 マネーフォワード社CQO高橋寿一氏が語るQAの最前線とキャリアについて 米MSと日立で品質を極めてきた2人が、マネーフォワードCQOに就任。日本企業が囚われている品質保証の呪縛とは？ User Focusを意識しながら、さらなるスピードと品質の向上を目指す。【マネーフォワードCQOインタビュー】"
【Webアプリケーションエンジニア（テックリード候補）】マネーフォワードクラウド_東京（株式会社クラビス出向）,株式会社クラビスとは 株式会社クラビスは、2017年にマネーフォワードグループにジョインし、マネーフォワードの100%子会社としてバックオフィス業務の効率化に注力したプロダクトを開発/提供しています。 クラビスが手がけるプロダクト「STREAMED」は、中小企業と会計/税理士事務所間で発生する業務に関わる課題解決を軸としており、これまで年平均で130%程度のペースで事業を成長させてきました。また、「STREAMED」は会計事務所のユーザーをメインとしていますが、現在全国で5400社を越える会計事務所に導入をいただいており、顧客満足度としても94.5%という高評価をいただきました。 一方で我々がSTREAMEDで目指したい・実現したい世界はここで終わりではなく、単なる入力業務の効率化に留まらない価値をユーザーに提供したいと考えています。 今後も「STREAMED」のノウハウを活用し、グループ内の連携を強化しながら、多くの企業が抱える業務課題の改善に貢献し続けていきます。 「クラウド記帳サービス STREAMED」：https://streamedup.com/ 募集背景 これまで「STREAMED」は小規模チームに分かれ、AIの活用とオペレーションの効率化の元、データ化の精度やスピードの向上とデータ化前後の体験の向上などに取り組み、データ化領域においては一定の課題解決ができるようになりました。その結果、マネーフォワードグループジョイン後、売上CAGR＋52%という成長を続けてきました。 一方で、現状は中小企業と会計事務所で行われる業務のうち、データ化という一部の領域しか効率化できていません。そこで今後、中小企業と会計事務所間の業務に対し、上流に向かって「STREAMED」で自動化していくことや、紙証憑の受け渡しのあり方を変えていくことも考えています。 より上流に向けて「STREAMED」の価値提供領域を広げていくことがプロダクトの次に目指したい姿であり、それらを実現するために体制を整えていく必要があります。 SaaSプロダクトとしての価値向上や独自性を追求すべく、データ化のみならず顧客の業務プロセス全体の効率化をともに目指していける仲間を募集したいと考えています。 業務概要 クラビスのSTREAMED事業ではAIxBPOxSaaSという切り口でバックオフィス業務を効率化する「STREAMED」というプロダクトを提供しています。 「STREAMED」は領収書・レシート・通帳といった企業のお金の取引が記録された紙を正確かつ高速にデータ化し仕訳という会計上のフォーマットに変換しています。AIとBPOのオペレータによる処理を上手く組み合わせることで精度99.9%以上の正確さでデータ化を行っています。 結果的にユーザーがこれまで行っていた紙を見ながら仕訳を入力するという業務負担の 6 割を削減し、ユーザーの業務効率化を実現しています。 現状、「STREAMED」の市場での認知が増え、会計事務所を含む利用は拡大の一途を辿っています。一方で、会計領域にとどまらず、バックオフィス部門の生産成功率に寄与するプロダクトとしてさらなる価値を発揮するには、進化は必須であり、クラビスではSTREAMED開発チームの力を最大限に引き出していく必要があります。開発プロジェクトの推進とエンジニアチームの成長を支え、技術面でチームを牽引していただける方を求めています。 【業務詳細】 STREAMED開発チームのエンジニアとして、プロダクト開発を行なっていただきます。「STREAMED」は大きく分けると2つの機能に分かれており、データ化を支えるシステムを開発するDockチームと、会計事務所などのユーザーが利用するWebシステムを開発するStreamedチームが開発を行っています。今回の募集では、Dockの開発から参画いただき、経験と適性を加味しながら、チーム専属、または開発部内で横断的に開発を行っていただく予定です。 それぞれのチームが担う領域は以下です。 Dockチームでは、「STREAMED」のコア機能である紙をデータ化するシステムを開発しています。 「STREAMED」のデータ化において、オペレータとAIのそれぞれの能力・特性を最大限に引き出し正確かつ高速に処理が進むようなシステムを構築しています。また、「STREAMED」はクラビス創業時から開発しているプロダクトであり継続的なユーザー数の増加を実現してきた結果、当初の想定よりも多くのデータ量が流入するようになっており、安定した稼働を続けるための改善が求められています。今後はデータ化のあり方を根本から見直しスケールするシステムへのリアーキテクトしていく開発を予定しています。 Streamedチームでは、ユーザーが使用するシステム、仕訳の作成・修正や各種会計ソフトとの連携などの機能改善や新規機能の追加を行っていただきます。 「STREAMED」は会計領域と深く関わっているプロダクトであるため、ユーザーの利便性だけでなく、法令対応など、様々な課題に対応する必要があります。例えば2023年より施行されたインボイス制度のような税制の改正がこれにあたります。会計は企業にとって必須かつ重要な領域であり、こうした外的要因に由来する対応も迅速に行う必要があります。ユーザーの利便性やサービスの向上といった分野と会計という領域だからこそ発生する分野の開発に対して、優先度を見極めて便利で安心して利用しつづけることのできるプロダクトとして進化させることに取り組んでいます。 現在、システムボトルネックが存在しており、特に繁忙期での運用課題に直面している状態です。それらボトルネックを解消し、安定的な運用が実現できる基盤を構築すること、そして「STREAMED」が目指す中長期的な展望を実現できるシステムと開発組織を共につくっていただきたいと考えています。 具体的には以下のような業務を行い、将来的にはチームを技術的にリードしていくことを期待しております。 Dockシステムの開発 システム安定稼働のためのボトルネックの特定とその解消のためのリアーキテクト 技術負債の解消 問い合わせ対応、エラー調査などのシステム運用 開発環境の改善などの開発生産性向上につながる取り組み 新機能開発や機能改修のプロジェクト 開発環境 言語：Python、PHP、JavaScript フレームワーク：Django、FuelPHP、React データベース：MySQL プロジェクト管理：Github インフラ：AWS モニタリング：Datadog、Sentry DockではFuelPHPを使用しています。StreamedではWebのバックエンドに Django、フロントエンドにReactをフレームワークとして導入しています。アプリケーションの プラットフォームとしてはWebだけでなくWindows、iOS、Androidにもアプリを展開しています。 求めるスキル・経験 2つ以上の開発言語を実務で使用した経験 Web開発エンジニアとしての5年程度の開発経験 BE/FE両方の知見 開発プロジェクトの上流工程の経験 システムの保守/運用経験 事業やプロダクトの抱える課題を明確にし、改善する施策を実行した経験 歓迎するスキル・経験 大規模プロジェクトをリードした経験 フルリモート環境下でのプロジェクト推進経験 チームに対してスキルやナレッジを共有し、チームの成長に貢献した経験 メンバーの課題を把握し、育成や教育、適切なアサインなどを行った経験 求める語学力 英語に抵抗がない方：エンジニア組織で英語化を推進しています。 ※TOEIC水準で500点以上の英語力がある方 ※英語証憑：TOEIC、英検、TOEFL、IELTS、ケンブリッジ英語検定 FCE など。 ※英語証憑をお持ちでない方については選考プロセスの過程で弊社指定の試験を受験いただきます。（原則、一次面接後を想定） ※FY25の4月から英語研修を開始し、FY26末にマネーフォワードの開発部と同じ水準（TOEIC700）の英語力を身につけていただきます。 環境 開発環境/スペック：MacBook Pro のハイスペックPCを標準支給し、希望される方にはディスプレイも貸与いたします。 スキルアップ補助制度があり、ChatGPT Plus 及び ChatGPT API 利用料、 GitHub Copilot、外部のセミナー参加費用の補助をしています。 書籍購入補助制度があり、各自で自由に書籍を会社費用で購入することができます。 この仕事の魅力 マネーフォワードグループにおいて、士業向けのプロダクトは事業戦略上重要な立ち位置であり、その中でも「STREAMED」は主要なポジションを担っています。そのため、自ら手がけたプロダクトがユーザーにどのように使われ、どういった価値を提供しているかをダイレクトに感じるだけでなく、事業全体に対する影響力を実感いただけるはずです。また、「STREAMED」に留まらず、新しいプロダクトを創る可能性やチャレンジの幅を広げることも望め、事業の成長とともに自身のキャリアを伸ばしたり、新しいチャレンジを行い幅を広げるなど、さまざまな選択肢が広がります。 一般的なWebアプリとしての課題解決方法に留まらず、AIやBPOを活用した解決方法で顧客課題に取り組むことができる 既に顧客基盤のある状態でプロダクトを進化させていく挑戦ができる ビジネス側と緊密に連携してプロダクトの開発を行うことができる ユーザーとも直接会話しながらプロダクトの開発を行うことができる チーム拡大の立ち上げフェーズに関与し、組織の成長に大きく貢献できる 次のキャリアステップとして、チームを横断した技術マネジメントの経験を積むことができる チームの組織構成を検討する・システムの境界を検討するなど、組織全体の開発に関わる上流部分の意思決定に関わっていくことができる
